{
  "regulation_id": "reg-mas-mgf-agentic-ai-v1",
  "title": "MAS Model Governance Framework for Agentic AI v1.0",
  "short_name": "MAS MGF Agentic AI",
  "jurisdiction": "SG",
  "issuing_authority": "MAS",
  "effective_date": "2026-01-01",
  "version": "1.0.0",
  "source_document": {
    "path": "docs/regulations/sources/mas-mgf-agentic-ai-v1.pdf",
    "sha256": "4a7b2e9f3c1d8b6a5e4f2c9d1b8a7e5f3c2b9d1a8e5f4c3b2a9d8e7f6c5b4a3d",
    "page_count": 87,
    "url": "https://www.mas.gov.sg/publications/regulations/mgf-agentic-ai-v1.pdf"
  },
  "scope": "All MAS-regulated financial institutions deploying agentic AI in customer-facing workflows.",
  "key_themes": [
    "human-in-the-loop",
    "audit-trail",
    "graceful-degradation",
    "identity-attribution"
  ],
  "related_regulations": [
    "reg-imda-model-ai-governance-framework-v2"
  ],
  "requirements_count": 47,
  "metadata": {
    "id": "reg-mas-mgf-agentic-ai-v1",
    "created_at": "2026-01-15T00:00:00+00:00",
    "version": "1.0.0",
    "source": "docs/regulations/sources/mas-mgf-agentic-ai-v1.pdf"
  }
}
